{"admissionSequence":2,"allocationHash":"98b77a60395041c96fdda219e0b0e8609d127acd42668c8f7e8d502d8835a2ad","compatibilityKey":"sha256:8d1dd12b458da77b329e68d6e96645ed2e0618ef7645900d72b85a54c662ff15","files":[{"bytes":70,"kind":"report","relativePath":"report.md","sha256":"7506896f017ac56499260a869f1ea386cb1701761c00928fff888eab2da4e4e1"},{"bytes":23,"kind":"query","relativePath":"query.txt","sha256":"5b204835e7938e4ad3ce216d4926316702aee8b728f497a34e65cdd0690a71f3"},{"bytes":70,"kind":"manifest-data","relativePath":"run.json","sha256":"eb4fd518a0384db18546c27331ab954ea07bf6f21cb07154fcc288cc7718a222"},{"bytes":21,"kind":"source","relativePath":"sources/S1.md","sha256":"a8b7fb29b33c2a684b5536e65fb93ca7f6bc0f67f08c9c0a79eb3b21724b29e8"},{"bytes":20,"kind":"extraction","relativePath":"extractions/S1.md","sha256":"e27bc19a3690cfc76724d38249c788c6f5df1b30bfdc5547f6118d8fa9ad99c2"}],"namespaceId":"0123456789abcdef0123456789abcdef","nonEvidence":[{"bytes":31,"relativePath":"late/S2.md","sha256":"62a5460386aeff10be9dbed050e3f2012d0802aefc301ab8c86f5970ad5ffbe9"}],"query":"example run store query","reportOutcome":"succeeded","runId":"2026-10-18-example-run-store-query-22222222222222222222222222222222","schema":"intelli-v1/committed","schemaVersion":1,"startedUtc":"2026-10-18T12:00:00.000Z"}
